id,title,category,description,published,status,linkUrl,tags,image
topic-2026-001,第39回ダイキンオーキッドレディスは大会結果を公開,大会結果,2026年3月5日から8日まで琉球ゴルフ倶楽部で開催された大会の順位・スコア情報が公式ページで確認できます。,2026-03-08,published,https://www.daikin.co.jp/orchid,最新 情報 ダイキン オーキッド レディース 結果 成績 琉球 ゴルフ 倶楽部,
topic-2026-002,エナジックオープンU-22の最終結果が掲載,ジュニア,名護市のエナジック瀬嵩カントリークラブで開催された若手向け大会。最終結果、組み合わせ、ローカルルールを確認できます。,2026-01-18,published,https://www.enagic-junioropen.com/tournament/2026/,最新 情報 エナジック オープン U-22 ジュニア 最終結果 名護,
topic-2026-003,ザ・リッツ・カールトン沖縄カップ2026の開催レポート,イベント,宿泊・食事・かねひで喜瀬カントリークラブでのコンペを組み合わせたリゾートゴルフイベントのレポートが公開されています。,2026-03-25,published,https://www.funq.jp/even/article/1055354/,最新 情報 リッツ カールトン 沖縄 カップ 喜瀬 コンペ リゾート ゴルフ,
topic-2026-004,試打会情報を探しやすくする公式ページが新設,試打会,日本ゴルフ用品協会が加盟メーカー各社の試打会情報を一元的に確認できるページを公開。沖縄開催分の確認先として活用します。,2026-04-06,published,https://newscast.jp/smart/news/7721289,最新 情報 試打会 日本 ゴルフ 用品 協会 JGGA クラブ,
topic-2026-005,沖縄県内のゴルフ場・大会・練習場情報を順次更新中,お知らせ,おきなわGOLFなびでは県内の大会情報・施設情報・イベント情報を確認しながら更新しています。,2026-05-31,published,,最新 情報 お知らせ 沖縄 ゴルフ,
